nombre,website,telefono,ciudad,vertical,snippet,fuente,outreach_status,web_score,scraped_at
"Medical Aesthetics Clinics in Buenos Aires, Argentina - WhatClinic",https://www.whatclinic.com/beauty-clinics/argentina/buenos-aires,,CABA,clinica,All 15 clinics that provide Medical Aesthetics in Buenos Aires · EME Centro Capilar · Cirugia and Láser Dr. Pérez Rivera · Carisma Medical Center - Hombres.,serper,pending,0,2026-06-15T01:34:50.732736Z
Clínica San Camilo | Atención médica en Buenos Aires,https://clinicasancamilo.org.ar/,,CABA,clinica,"Clínica San Camilo en Buenos Aires. Atención médica integral, guardia, internación y diagnóstico con profesionales especializados.",serper,pending,0,2026-06-15T01:34:50.732766Z
Centro Medico Buenos Aires Medellin | Consulta médica General ...,http://centromedicobuenosairesmedellin.com/,,CABA,clinica,"Nuestros campos de acción son las ayudas diagnósticas, laboratorio clínico y consulta médica general y especializada. Ver más ...",serper,pending,0,2026-06-15T01:34:50.732799Z
Salud - Gobierno de la Ciudad Autónoma de Buenos Aires,https://buenosaires.gob.ar/gcaba_historico/salud,,CABA,clinica,"Podés consultar el empadronamiento del sistema de salud, servicios, personas mayores, programas y prevención en hospitales y CeSAC de la ciudad.",serper,pending,0,2026-06-15T01:34:50.732827Z
Centro Médico Buenos Aires – Centro integral de salud,https://cemeba.com.ar/,,CABA,clinica,"En el Centro Médico Buenos Aires brindamos atención integral con calidez humana y tecnología de vanguardia. Contamos con profesionales altamente capacitados, ...",serper,pending,0,2026-06-15T01:34:53.545830Z
Sanatorio Mater Dei | Buenos Aires,https://www.sanatoriomaterdei.com.ar/,,CABA,clinica,Sanatorio Mater Dei: San Martín de Tours 2952 (CP 1425 - Buenos Aires.) Teléfono: 4809-5555. Consultorios Externos 3360: Castex 3360 (CP 1425 - Buenos Aires.),serper,pending,0,2026-06-15T01:34:53.545907Z
Sanatorio Otamendi,https://www.otamendi.com.ar/,+54114965290,CABA,clinica,"Sanatorio Otamendi Azcuénaga 870, CABA Argentina (C1115AAB) +54 11 4965-2900 +54 11 2838 2351",serper,pending,0,2026-06-15T01:34:53.545928Z
Sagrado Corazón | Sanatorio de Alta Complejidad,https://sagradocorazon.net.ar/,,CABA,clinica,Sagrado Corazón es el centro de alta complejidad (11) 5238.7800 / Ciudad de Buenos Aires Argentina (011) 5238.7800,serper,pending,0,2026-06-15T01:34:53.545963Z
Sanatorio Güemes: Inicio,https://sitio.sg.com.ar/,,CABA,clinica,"Sanatorio Güemes damos la bienvenida al Centro Médico Rossi que se suma a nuestro sanatorio, incorporando. Córdoba - Av. Córdoba 3933 CABA, Argentina",serper,pending,0,2026-06-15T01:34:53.546005Z
Hospital Nacional Posadas,https://www.argentina.gob.ar/salud/hospital-nacional-posadas,,CABA,clinica,"Av. Pte. Illia s/n, El Palomar, Buenos Aires Código postal: 1684 Teléfono: (54-11) 4469-9200 / 4469-9300 Correo electrónico: oficinapaciente@hospitalposadas. ...",serper,pending,0,2026-06-15T01:34:53.546046Z
Sanatorio de la Providencia - Tu Centro Médico de Confianza,https://sanatoriodelaprovidencia.com/,,CABA,clinica,"Turnos por whatsapp. Turnos por whatsapp (+54 9) 011 – 6300-5284. Lun a Vie 8 a 19hs. ; Turnos online. Si ya sos paciente, sacá tu turno online de manera fácil y ...",serper,pending,0,2026-06-15T01:34:53.546106Z
Sanatorio - ObSBA - Obra Social de la Ciudad de Buenos ...,https://www.obsba.org.ar/sanatorio/,,CABA,clinica,Servicios del Sanatorio ; OFTALMOLOGIA ; OTORRINOLARINGOLOGIA ; PATOLOGIA MAMARIA ; PROCTOLOGIA ; TRAUMATOLOGIA ...,serper,pending,0,2026-06-15T01:34:53.546180Z
HOSPITAL PRIVADO Universitario de Córdoba,https://hospitalprivado.com.ar/,,Unknown,clinica,"Hospital Privado de Córdoba, somos un grupo de profesionales de reconocida trayectoria a nivel nacional e internacional.",serper,pending,0,2026-06-15T01:34:55.627016Z
Sanatorio Córdoba,https://sanatoriocordoba.com.ar/,,Unknown,clinica,GUARDIA 24 HS LOS 365 DÍAS DEL AÑO Consultorios externos con todas las especialidades. Internación Clínica y Quirúrgica Unidad de Terapia Intensiva (UTI),serper,pending,0,2026-06-15T01:34:55.627072Z
Clinica Privada Los Arcos,https://clinicaprivadalosarcos.com.ar/,,Unknown,clinica,"Es jefe de Servicio de Cirugía General de Clínica Privada Los Arcos de Córdoba, Argentina. Especialista en Cirugía Mínimamente Invasiva, Endocrina, Bariátrica, ...",serper,pending,0,2026-06-15T01:34:55.627107Z
Hospital Córdoba | Centro de Alta Complejidad Argentina,http://hospitalcordoba.com.ar/,,Unknown,clinica,"Hospital Público de la provincia de Córdoba dedicado primordialmente a la atención de la alta complejidad, destacándose en la atención de neurocirugías y ...",serper,pending,0,2026-06-15T01:34:55.627140Z
Health Tourism - Visit Córdoba,https://visitcordoba.ar/en/health-tourism/,,Unknown,clinica,"Córdoba is a medical excellence center in Latin America, which makes it an ideal place to undergo medical treatments. Physicians, surgeons and other ...",serper,pending,0,2026-06-15T01:34:55.627172Z
Hospital Italiano de Córdoba – Te cuidamos siempre.,http://www.hospital-italiano.org.ar/,03514106500,Unknown,clinica,Central Telefónica. 0351 410 6500. Lunes a Viernes 8 a 20 h. ; WhatsApp Turnos. 351 633 2461. Lunes a Viernes 8 a 18 h. ; Diagnóstico por Imágenes. 351 633 2429.,serper,pending,0,2026-06-15T01:34:55.627215Z
"clinica y maternidad del sol | salud | Chacabuco 705, Córdoba ...",https://www.clinicadelsol.com.ar/,3517555444,Unknown,clinica,Turnos de lunes a viernes de 8 a 21hs. Teléfono call center: 0810 555 2765 WhatsApp central de turnos: 3517555444. Derivaciones Médicas: 3516523503.,serper,pending,0,2026-06-15T01:34:55.627286Z
Taller Mecánico en Avellaneda | MDO Garage,https://mdogarage.com/,,CABA,taller,"Hernan Cortés 731, B1870 Sarandí, Provincia de Buenos Aires · 011 15-2176-0897 · mecanicadavidoff.byokos@gmail.com · MDO Garage - Taller Mecanico en Avellaneda ...",serper,pending,0,2026-06-15T01:34:57.838360Z
Taller Mecánico Bertani – Más de 50 años de experiencia en ...,https://tallerbertani.com.ar/,,CABA,taller,Cambio Correa distribución en Zona Norte Buenos Aires Argentina Taller Mecánico Bertani. Más información en nuestro sitio especializado en correas de ...,serper,pending,0,2026-06-15T01:34:57.838423Z
Taller mecánico de todas las marcas en Ciudad Autónoma Buenos ...,https://www.autocosmos.com.ar/servicios?pr=324&ts=1,,CABA,taller,Taller mecánico de todas las marcas en Ciudad Autónoma Buenos Aires ; INTERNACIONAL MOTORS. Almagro - ; Lepic. Barracas - ; Matadero Motors. Mataderos - ; Matadero ...,serper,pending,0,2026-06-15T01:34:57.838473Z
"Empleos de Taller Mecanico en Capital Federal, Buenos Aires","https://ar.indeed.com/q-taller-mecanico-l-capital-federal,-buenos-aires-empleos.html",,CABA,taller,"Empleos de Taller mecanico en Capital Federal, Buenos Aires · TÉCNICO PARA TALLER · Tecnico/a Mecánico c/Experiencia en taller · Chapista/pintor de Camiones.",serper,pending,0,2026-06-15T01:34:57.838515Z
Taller mecánico Saavedra - Reparación de autos en Saavedra | Flama,https://www.tallerflama.com.ar/,,CABA,taller,"Taller mecánico en el barrio de Saaveda. Mecánica integral del automovil, todas las marcas, diagnóstico computarizado, diagnóstico pre VTV.",serper,pending,0,2026-06-15T01:34:57.838615Z
Mecánica y Automotriz - Formación Profesional - Buenos Aires Ciudad,https://buenosaires.gob.ar/gcaba_historico/educacion/agencia-de-habilidades-para-el-futuro/catalogo-de-oferta-educativa-mecanica-y-0,,CABA,taller,"Aquí encontrarás una amplia variedad de cursos, talleres, carreras y recursos diseñados para potenciar tu aprendizaje y desarrollo profesional. Compartir en ...",serper,pending,0,2026-06-15T01:34:57.838654Z
Servicio Mecánico a domicilio en Córdoba Capital Argentina,https://www.tallermecanicocordoba.com/,3516646104,Unknown,taller,TEL: 351 6646104. Además disponemos de taller para problemas mas complejos Llámenos o escribanos por whatsapp al 351 6646104 0351 15-664-6104,serper,pending,0,2026-06-15T01:35:00.266093Z
Mecánico a Domicilio en Córdoba,https://www.mecanicodecordoba.com/,,Unknown,taller,Mecánica integral a domicilio todos los días (incluye feriados). Atendemos todas las marcas y contamos con dos talleres en Córdoba Capital. electric_car ...,serper,pending,0,2026-06-15T01:35:00.266168Z
Mecánico en cordoba capital - Reddit,https://www.reddit.com/r/Cordoba/comments/1odorf4/mec%C3%A1nico_en_cordoba_capital/,,Unknown,taller,"En la O'Higgins entre Olaen y Copina, justo frente al Electrohiggins. Esta medio escondido, parece mas un garage que otra cosa pero esta al ...",serper,pending,0,2026-06-15T01:35:00.272450Z
Talleres en Córdoba - Bosch Car Service,https://am.boschcarservice.com/ar/es/buscador/talleres-cordoba/,,Unknown,taller,"Talleres en Córdoba. Encuentre su taller mecánico 16 Talleres. Hoy Abierto 08:30 - 13:30, 14:30 - 17:30 Castro Barros 1055 5000 Cordoba. Av O'Higgins 4372. ...",serper,pending,0,2026-06-15T01:35:00.272526Z
Taller mecánico en Córdoba - Terra GNC,https://terragnc.com.ar/terra-taller-mecanico-en-cordoba/,,Unknown,taller,"Realizamos diagnósticos y reparaciones integrales para vehículos nafteros, diésel y con GNC. Nuestro equipo técnico está preparado para atender todo tipo de ...",serper,pending,0,2026-06-15T01:35:00.272599Z
Tienda Online de Gomeria Altamirano,https://gomeriasaltamirano.com.ar/?srsltid=AfmBOoo8Vsqkty0OF_92zNryVBiqJYcoH1hS5QRtJ2jfgXdK7PSix-lQ,,CABA,taller,"Comprá productos de Gomeria Altamirano por internet. Tenemos auto radial michelin, camioneta radial michelin y más. Hacé tu pedido y pagalo online.",serper,pending,0,2026-06-15T01:35:02.596062Z
Gomeria y Distribuidora Silva | Insumos y Servicio para Gomerías,https://www.silvadistribuidora.com/,,CABA,taller,En Distribuidora Silva nos especializamos en la venta de insumos para gomería en toda Argentina. +54 11 5749 3191. Buenos Aires - Argentina,serper,pending,0,2026-06-15T01:35:02.596123Z
Gomería Central,https://www.gomeriacentral.com/,,CABA,taller,"Ofrecemos los mejores precios del país en neumáticos, cubiertas y accesorios para tu vehículo. Con envios gratis y 4 sucursales en Córdoba Capital.",serper,pending,0,2026-06-15T01:35:02.596169Z
"Gomeria Rs4 Neumaticos & Servicios, Castro Barros, 411, Buenos ...",https://www.mapquest.com/ar/buenos-aires/gomeria-rs4-neumaticos-servicios-776486524,,CABA,taller,Nos especializamos en ofrecer neumáticos de alta calidad y servicios especializados para tu vehículo. Nuestra misión es brindarte soluciones rápidas y ...,serper,pending,0,2026-06-15T01:35:02.596215Z
GOMERIAS - Provincia de Buenos Aires |,https://www.gba.gob.ar/content/gomerias,,CABA,taller,"DAYTONA/ NEUMASUR, 5% a 60%, TODOS LOS DÍAS ; DAYTONA/ NEUMASUR, 5% a 60%, TODOS LOS DÍAS ; DAYTONA/ NEUMASUR, 5% a 60%, TODOS LOS DÍAS ; DAYTONA/ NEUMASUR, 5% a ...",serper,pending,0,2026-06-15T01:35:02.596272Z
RIVA – Empresa constructora,https://riva.com.ar/en/,,CABA,constructora,"Somos una empresa constructora de sólida trayectoria y experiencia, con un equipo profesional plenamente comprometido con el cumplimiento y capaz de brindar ...",serper,pending,0,2026-06-15T01:35:04.702383Z
CRIBA Empresa Constructora Argentina - Nosotros Construimos,https://www.criba.com.ar/,,CABA,constructora,Brindamos servicios de construcción de alta calidad en obras de ingeniería y arquitectura. Queremos mejorar la vida de las personas con nuestras obras.,serper,pending,0,2026-06-15T01:35:04.702466Z
Las principales empresas constructoras de Buenos Aires en 2024,https://mindlindevelopers.com/blog/las-principales-empresas-constructoras-de-buenos-aires-en-2024/,,CABA,constructora,Las principales empresas constructoras de Buenos Aires en 2024 · 1. Techint · 2. 🏗️ Caputo · 3. Criba · 4. 🛣️ J. Cartellone Construcciones Civiles.,serper,pending,0,2026-06-15T01:35:04.702576Z
Constructora en CABA | Proyectos Inmobiliarios de Calidad,https://estudiokohon.com/constructora-caba/,,CABA,constructora,"En Estudio Kohon, somos una constructora con más de 40 años de experiencia en el desarrollo y ejecución de proyectos inmobiliarios en la Ciudad Autónoma de ...",serper,pending,0,2026-06-15T01:35:04.702620Z
Buscador de empresas de Construcción / obras en Buenos Aires,https://ar.computrabajo.com/empresas/empresas-de-construccion-y-obras-en-buenos-aires,,CABA,constructora,"118 Empresas de Construcción / obras en Buenos Aires ; Kat · Mar del Plata, Buenos Aires ; LIVIO BORTOLIN E HIJO S R L · 3 de Febrero, Buenos Aires ; INIZIALE S.A..",serper,pending,0,2026-06-15T01:35:04.702659Z
▷ Empresa Constructora 【1124840425】 Gablos S.A. ☑️,https://construccionesarg.com.ar/,,CABA,constructora,"Profesionales altamente cualificados para la ejecución de obras compuesto por Ingenieros, Jefes de Obra, Topógrafos, Técnicos, Encargados y Administrativos.",serper,pending,0,2026-06-15T01:35:04.702693Z
Empresas (cantidad de noticias) - Construar.com.ar,https://www.construar.com.ar/ver-empresas/,,CABA,constructora,VIAL AGRO SA (272) · EDECA SA (252) · ROVIAL SA (223) · OBRING SA (204) · MUNDO CONSTRUCCIONES SA (201) · C.N. SAPAG SOCIEDAD ANONIMA (190) · PECAM SA (189) ...,serper,pending,0,2026-06-15T01:35:04.702764Z
Marassa Construcciones: Construcción Llave en Mano - Crédito ...,https://www.marassaconstrucciones.com.ar/,,Unknown,constructora,"Ofrecemos un servicio integral de construcción llave en mano en Córdoba, desde el diseño hasta el último detalle de la casa terminada, garantizando el ...",serper,pending,0,2026-06-15T01:35:06.921066Z
SAPYC SRL – Empresa Constructora. Proyectos de ingeniera y ...,https://www.sapyc.com/,,Unknown,constructora,"La Empresa se encuentra en el centro del país, Ciudad de Córdoba, en un principio sus oficinas funcionaban en Av. Madrid 2338 de la misma ciudad, pero con el ...",serper,pending,0,2026-06-15T01:35:06.921394Z
GRIF,https://grif.com.ar/,,Unknown,constructora,"Somos una empresa constructora con base en Córdoba y más de 20 años de trayectoria en el desarrollo de obras de arquitectura, especializada en edificios ...",serper,pending,0,2026-06-15T01:35:06.921443Z
187 Empresas de Construcción / obras en Córdoba - Computrabajo,https://ar.computrabajo.com/empresas/empresas-de-construccion-y-obras-en-cordoba,,Unknown,constructora,187 Empresas de Construcción / obras en Córdoba · Devel · Ingerod · OSUNA GONZALO RODRIGO · Casa Real Viviendas · FIX ASCENSORES SOCIEDAD POR ACCIONES SIMPLIFICADA.,serper,pending,0,2026-06-15T01:35:06.921499Z
Constructora de obras en córdoba -,https://www.mancor.com.ar/,,Unknown,constructora,"En MANCOR, somos la empresa constructora líder en Córdoba, Argentina. Con más de 15 años de experiencia y 120+ proyectos exitosos, nos especializamos en ...",serper,pending,0,2026-06-15T01:35:06.921573Z
Grupo Proaco - Desarrollos Inmobiliarios en Córdoba.,https://grupoproaco.com/,,Unknown,constructora,Somos un grupo desarrollista líder en Argentina que avanza construyendo productos de excelente calidad con los más altos estándares de cumplimiento del mercado.,serper,pending,0,2026-06-15T01:35:06.921623Z
Empresa constructora de Córdoba especialista en Steel Framing,https://acedur.com/sobre-acedur/,,Unknown,constructora,"Somos Acedur, una empresa constructora de Córdoba, Argentina, especializada en Steel Framing, el sistema constructivo de construcción en seco.",serper,pending,0,2026-06-15T01:35:06.921666Z
Empresa Constructora Córdoba,https://empresaconstructoracordoba.com/,,Unknown,constructora,En JR Constructora somos especialistas en construcción industrial y comercial en Córdoba. Nuestro equipo combina experiencia técnica con planificación detallada ...,serper,pending,0,2026-06-15T01:35:06.921701Z
Empresa constructora en Capital Federal - Buenos Aires,https://burosteelframing.com/empresa-constructora-en-capital-federal-buenos-aires/,,CABA,constructora,Ventajas de construir en Buenos Aires con profesionales · Experiencia comprobada en proyectos urbanos. · Flexibilidad en métodos constructivos: sistema húmedo o ...,serper,pending,0,2026-06-15T01:35:09.500627Z
Empresa constructora y obras de arquitectura,https://cemasde.com.ar/,+5491154203615,CABA,constructora,Contactenos |; 11 4784-3796 | Whatsapp +5491154203615 | Whatsapp +549116398-5370; | info@cemasde.com.ar. Empresa constructora y obras de arquitectura.,serper,pending,0,2026-06-15T01:35:09.500668Z
Registro de Empresas - AADAIH - Asociación Argentina de ...,https://aadaih.org.ar/empresas,3484435000,CABA,constructora,"Empresas Constructoras, Av. Leandro N. Alem 986, Piso 7, Capital Federal ... Buenos Aires, Escobar, marketing@mapei.com.ar, 3484435000, https://www.mapei.com ...",serper,pending,0,2026-06-15T01:35:09.500700Z
Thesing Construcciones S.A. - Empresa Constructora en Buenos Aires,https://thesing.com.ar/,,CABA,constructora,"Somos Thesing. Diseñamos y ejecutamos proyectos de construcción enfocados en la calidad de los procesos, con know how técnico y evolución continua para los ...",serper,pending,0,2026-06-15T01:35:09.500739Z
Where to Stay in Buenos Aires: A Local's Guide - Sol Salute,https://solsalute.com/blog/where-to-stay-in-buenos-aires-argentina/,,CABA,hotel,"A complete guide to where to stay in Buenos Aires, Argentina including the best neighborhoods, the best hotels, hostels, and apartments.",serper,pending,0,2026-06-15T01:35:12.060038Z
Buenos Aires Luxury Hotel | Recoleta 5-Star Hotel | Four Seasons,https://www.fourseasons.com/buenosaires/,,CABA,hotel,"Four Seasons Hotel Buenos Aires is a luxury hotel combining modern comfort with European-style glamour, fine dining and more in the heart of Recoleta.",serper,pending,0,2026-06-15T01:35:12.061886Z
"Hotels in Buenos Aires, Argentina | Marriott Bonvoy",https://www.marriott.com/en-us/destinations/argentina/buenos-aires.mi,,CABA,hotel,"Marriott Bonvoy's collection of hotels in Buenos Aires provides a splendid entry conveniently located near premier museums, theaters,",serper,pending,0,2026-06-15T01:35:12.061972Z
Browse Buenos Aires Hotels for 2026,https://www.hotels.com/de14534/hotels-buenos-aires-argentina/,,CABA,hotel,"Some of the most popular luxury hotels in Buenos Aires are Hilton Buenos Aires, Alvear Palace Hotel, and Hotel Madero Buenos Aires, WorldHotels Elite.",serper,pending,0,2026-06-15T01:35:12.062007Z
Where to Stay in Buenos Aires - the 14 Best Luxury Hotels,https://luxurylatinamerica.com/blog/2025/09/01/where-to-stay-in-buenos-aires/,,CABA,hotel,Where to Stay in Buenos Aires – the 14 Best Luxury Hotels · Alvear Art Hotel · Alvear Palace Hotel · Casa Lucia Melia Collection · Faena Hotel and ...,serper,pending,0,2026-06-15T01:35:12.062049Z
Hilton Buenos Aires Hotel in Puerto Madero,https://www.hilton.com/en/hotels/buehihh-hilton-buenos-aires/,,CABA,hotel,"Hilton Buenos Aires, Argentina, is a landmark in the upscale harborside area of Puerto Madero. With modern rooms, upscale dining and some of the best views ...",serper,pending,0,2026-06-15T01:35:12.062083Z
Buenos Aires Luxury Hotels - Forbes Travel Guide,https://www.forbestravelguide.com/destinations/buenos-aires-argentina,,CABA,hotel,"View the best hotels, restaurants and spas in Buenos Aires, with Five-Star ratings and more from Forbes Travel Guide.",serper,pending,0,2026-06-15T01:35:12.062114Z
"Hotels in Buenos Aires, Argentina | Best Price at nh-hotels.com",https://www.nh-hotels.com/en/hotels/buenos-aires,,CABA,hotel,"NH Hotels has 9 hotels in the city, all of which offer you excellent locations close to the main tourist and business areas of Buenos Aires.",serper,pending,0,2026-06-15T01:35:12.062148Z
Best Hostels in Buenos Aires from €0.01 | 2026 - Hostelworld,https://www.hostelworld.com/hostels/south-america/argentina/buenos-aires/,,CABA,hotel,Best hostels for solo travellers in Buenos Aires ; Primavera Hostel. 9.8 ; Lead Hostel. 9.4 ; ilVero Hostel Recoleta. 9.1 ; Casa Franca Recoleta Hostel Boutique.,serper,pending,0,2026-06-15T01:35:14.463678Z
Hostales en Buenos Aires desde $ 20.235/noche - KAYAK,https://www.kayak.com.ar/Hoteles-en-Buenos-Aires_Albergue.Thostel.19264.hotel.ksp,,CABA,hotel,"El mes más barato para reservar un hostal en Buenos Aires es junio, con una tarifa promedio por noche de $ 21.680. El mes más caro es noviembre, ...",serper,pending,0,2026-06-15T01:35:14.463740Z
MILHOUSE HOSTEL Buenos Aires - Sitio Oficial,https://milhousehostel.com/,,CABA,hotel,"Ofrecemos una variedad de servicios y comodidades, incluyendo habitaciones privadas y compartidas con baño, wifi gratuito, aire acondicionado, lockers, caja de ...",serper,pending,0,2026-06-15T01:35:14.463774Z
Busca hostales en Buenos Aires - Expedia,https://www.expedia.com/es/Buenos-Aires-Hostales.d178242-aaHostales.Guia-Viajes-Alojamiento,,CABA,hotel,Nuestra selección de hostales en Buenos Aires · Casa Marina Argentina · Art Factory Soho · Play Hostel Garden · Sweet Home Palermo Soho Hostel · Viajero Hostel ...,serper,pending,0,2026-06-15T01:35:14.463810Z
Buenos Aires | Albergues | Hostales.com ®,https://www.hostales.com/Argentina/Buenos+Aires,,CABA,hotel,Hostales con desayuno gratis en Buenos Aires · Hostales con cancelación gratuita en Buenos Aires · Hostales con wifi gratis en Buenos Aires.,serper,pending,0,2026-06-15T01:35:14.463841Z
ᐉ MASTER HOSTEL ( ARGENTINA ) FOTOS DE VIAJEROS Y ...,https://master-hostel.buenosaireshotelsargentina.com/es/,,CABA,hotel,El Master Hostel Ciudad Autónoma de Ciudad Autónoma de Buenos Aires ofrece 23 habitaciones y se encuentra a 350 m del Polo Científico-Tecnológico.,serper,pending,0,2026-06-15T01:35:14.463890Z
Hostales en Buenos Aires desde $49.545/noche - KAYAK,https://www.kayak.com.co/Hoteles-en-Buenos-Aires_Albergue.Thostel.19264.hotel.ksp,,CABA,hotel,Buscas un hostal en Buenos Aires? Precios recientes: hostales en Buenos Aires desde $49.545. hostales de 2 estrellas desde $85.005 y 3 estrellas desde ...,serper,pending,0,2026-06-15T01:35:14.463938Z
The 5 best hostels in Buenos Aires (value for money) - YouTube,https://www.youtube.com/watch?v=TDG9aWPYru8,,CABA,hotel,"Descubre los mejores hostales en Buenos Aires calidad-precio este 2026, ideales para viajeros que buscan una estadía económica sin perder ...",serper,pending,0,2026-06-15T01:35:14.463972Z
Holiday Inn Cordoba - IHG Hotels & Resorts,https://www.ihg.com/holidayinn/hotels/us/en/cordoba/cbaar/hoteldetail,,Unknown,hotel,"The Holiday Inn Córdoba is located just 5 minutes from Kempes Park, an ideal place for outdoor sports. Enjoy top-class sports facilities and, upon returning to ...",serper,pending,0,2026-06-15T01:35:16.662406Z
"The 2 Best Luxury Hotels in Cordoba, Argentina",https://luxurylatinamerica.com/blog/2024/10/23/hotels-in-cordoba-argentina/,,Unknown,hotel,"Rates are $200 to $480 depending on the time of year, demand, and which room option you choose. See our full review of Azur Real Hotel Boutique ...",serper,pending,0,2026-06-15T01:35:16.662474Z
"Best places to stay in Cordoba Province, Argentina - The Hotel Guru",https://www.thehotelguru.com/best-hotels-in/argentina/cordoba-province,,Unknown,hotel,The best hotels in Cordoba Province · Mousai Hotel Boutique · Terra Firma Boutique Hotel · Sacha Mistol Art Hotel · Virreinato Hotel Boutique · Villa Art Hotel ...,serper,pending,0,2026-06-15T01:35:16.662511Z
Córdoba Luxury and 5 Star Hotels and Resorts,https://luxuryescapes.com/us/hotels/location/c%C3%B3rdoba/c%C3%B3rdoba/argentina?srsltid=AfmBOoqWNd2bSuabAD-xN0_rWT04_svplSo_l686P3BlJBfdov_IOeGc,,Unknown,hotel,"Exclusive deals on luxury hotels & resorts in Córdoba, Argentina. Enjoy 5-star accommodation at the best prices only with Luxury Escapes.",serper,pending,0,2026-06-15T01:35:16.662610Z
ᐉ THE HOTEL ⋆⋆⋆ ( ARGENTINA ) REAL PHOTOS ... - Cordoba,https://the.hotels-in-cordoba.net/en/,,Unknown,hotel,The 3-star The Hotel Cordoba is approximately a 25-minute walk from the Super Park Cordoba and features 24-hour front desk assistance and wake-up service.,serper,pending,0,2026-06-15T01:35:16.662646Z
Luxury Estancia in Argentina | Estancia El Colibrí Córdoba,https://www.estanciaelcolibri.com/en/,,Unknown,hotel,"In the heart of Argentina, just an hour from Córdoba's city center, Estancia El Colibrí Relais & Châteaux welcomes you to an exceptional setting.",serper,pending,0,2026-06-15T01:35:16.662679Z
Top 10 Hotels in Córdoba (from $27) 2026 - Competitive Prices,https://www.expedia.com/Cordoba-Hotels.d6054205.Travel-Guide-Hotels,,Unknown,hotel,"For family-friendly hotels in Cordoba, consider the Pinares Panorama Suites & Spa, Pinares del Cerro Resort & Suites, and Quórum Cordoba Hotel - Resort Urbano.",serper,pending,0,2026-06-15T01:35:16.662714Z
Hoteles en el centro en Córdoba,https://www.cordoba-hotels-ar.com/es/theme/central-hotels-8/,,Unknown,hotel,Gran Hotel Victoria Cordoba Argentina · Howard Johnson La Cañada Hotel&Suites · King David Flat Hotel - Argentina · Novum Suites · Faz Hostel Boutique · Zoom ...,serper,pending,0,2026-06-15T01:35:16.662748Z
"Hotels in Mar del Plata, Argentina | Marriott Bonvoy",https://www.marriott.com/en-us/destinations/argentina/mar-del-plata.mi,,Mar del Plata,hotel,Marriott Bonvoy's hotels in Mar Del Plata are the perfect starting point for your journey. Situated near top attractions such as the Museum of Fine Arts.,serper,pending,0,2026-06-15T01:35:18.785780Z
Browse Hotels in Mar del Plata - Experience 2026,https://www.hotels.com/de17212/hotels-mar-del-plata-and-vicinity-argentina/,,Mar del Plata,hotel,Sheraton Mar Del Plata Hotel · Hotel Spa Republica · O2 Hoteles Mar del Plata · Hotel Denver · Hotel Versailles · HOTEL KONKE · Costa Galana · Gran Hotel Continental.,serper,pending,0,2026-06-15T01:35:18.785851Z
