nombre,website,telefono,ciudad,vertical,snippet,fuente,outreach_status,web_score,scraped_at
"Hotels in Mar del Plata (Buenos Aires Province, Argentina) - Trivago",https://www.trivago.com/en-US/odr/hotels-mar-del-plata-argentina?search=200-137091,,Mar del Plata,hotel,"Compare the prices of 4034 hotels in Mar del Plata, Argentina. Find your ideal accommodation from hundreds of great deals and save with www.trivago.com.",serper,pending,0,2026-06-15T01:35:18.785889Z
"Official website - Best price - Hotel Iruña, Mar del Plata",https://www.hoteliruna.com/en/,,Mar del Plata,hotel,"Located in front of the sea, 100 meters from the beach Punta Iglesia, in the center of Mar del Plata. You will enjoy a 4-star stay in a strategic location in ...",serper,pending,0,2026-06-15T01:35:18.785941Z
"Best places to stay in Mar del Plata, Argentina | The Hotel Guru",https://www.thehotelguru.com/en-us/best-hotels-in/argentina/mar-del-plata,,Mar del Plata,hotel,"This classic hotel is located in Mar del Plata, Argentina. Interiors are dressed in luxurious, French style, with plush carpets, heavy curtains and crisp white ...",serper,pending,0,2026-06-15T01:35:18.785976Z
16 Best Hotels in Mar del Plata. Hotels from ₪59/night - KAYAK,https://www.il.kayak.com/Mar-del-Plata-Hotels.4012.hotel.ksp,,Mar del Plata,hotel,"The best deal for a 3-star hotel room in Mar del Plata found by KAYAK users in the last 3 days was ₪95, while a 4-star hotel the lowest price was ₪133.",serper,pending,0,2026-06-15T01:35:18.786020Z
"Mar del Plata | Alojamientos, Hoteles y Propiedades",https://mardelplata.com/,,Mar del Plata,hotel,"Buscá Hoteles, Cabañas y Departamentos en Mar del Plata. Portal Líder con Alojamientos, Inmobiliarias y Propiedades en Venta o Alquiler.",serper,pending,0,2026-06-15T01:35:18.786052Z
